date,chat_name,chat_id,sender_id,username,text
2025-02-20T20:18:32,💬 Data Practicum Chat,1379846874,user1349934990,Илья,Должность то какая?)
2025-02-20T20:28:48,💬 Data Practicum Chat,1379846874,user5160000471,Vasily Artemyev,Ишак
2025-02-20T20:29:48,💬 Data Practicum Chat,1379846874,user1349934990,Илья,Ну не худший вариант
2025-02-20T20:30:07,💬 Data Practicum Chat,1379846874,user1349934990,Илья,Мог бы быть датасаенс
2025-02-20T20:32:34,💬 Data Practicum Chat,1379846874,user5160000471,Vasily Artemyev,Ну один хрен ишачить...
2025-02-20T20:33:18,💬 Data Practicum Chat,1379846874,user1349934990,Илья,
2025-02-20T20:34:01,💬 Data Practicum Chat,1379846874,user947139537,Ilya Plotnikov,я не могу с этой гифки
2025-02-20T20:55:41,💬 Data Practicum Chat,1379846874,user172748379,Anna Glagoleva,Охранник
2025-02-20T20:56:03,💬 Data Practicum Chat,1379846874,user172748379,Anna Glagoleva,Дата Аналитик
2025-02-20T20:56:44,💬 Data Practicum Chat,1379846874,user5160000471,Vasily Artemyev,
2025-02-20T20:57:20,💬 Data Practicum Chat,1379846874,user1349934990,Илья,Т.е. две вакансии открыты?
2025-02-20T21:01:39,💬 Data Practicum Chat,1379846874,user172748379,Anna Glagoleva,Да
2025-02-20T21:02:17,💬 Data Practicum Chat,1379846874,user1349934990,Илья,"Я бы на охранника попробовал, но могу только удалённо"
2025-02-20T21:02:39,💬 Data Practicum Chat,1379846874,user172748379,Anna Glagoleva,Попробуй
2025-02-20T21:09:18,💬 Data Practicum Chat,1379846874,user100092469,Irina,на удаленке можно еще моделью ступней подрабатывать говорят
2025-02-20T21:09:50,💬 Data Practicum Chat,1379846874,user40196989,Алексей Яцына,Лох
2025-02-20T21:10:48,💬 Data Practicum Chat,1379846874,user234467651,Aleksey Voronin,да ты только обещаешь
2025-02-20T21:10:56,💬 Data Practicum Chat,1379846874,user1349934990,Илья,
2025-02-20T21:11:11,💬 Data Practicum Chat,1379846874,user100092469,Irina,я стесняюсь
2025-02-20T21:11:26,💬 Data Practicum Chat,1379846874,user1349934990,Илья,"Не скидывайте ей ничего, она - мошенница"
2025-02-20T21:15:30,💬 Data Practicum Chat,1379846874,user234467651,Aleksey Voronin,нашел там себя за 2005 год
2025-02-20T21:16:05,💬 Data Practicum Chat,1379846874,user1349934990,Илья,"Уже сеньор, получается"
2025-02-20T21:40:47,💬 Data Practicum Chat,1379846874,user947139537,Ilya Plotnikov,
2025-02-20T21:44:22,💬 Data Practicum Chat,1379846874,user947139537,Ilya Plotnikov,
2025-02-20T21:45:38,💬 Data Practicum Chat,1379846874,user100092469,Irina,
2025-02-20T22:02:43,💬 Data Practicum Chat,1379846874,user168336377,Мариян Умагалова,А сколько этапов собеседований?
2025-02-20T22:03:25,💬 Data Practicum Chat,1379846874,user350575220,Василий,"Всем привет Кто работает в банковском риск-анализе? Есть вопрос по расчету probability defolt, отпишите в лс кто сможет проконсультировать, есть небольшой вопрос)"
2025-02-20T22:05:14,💬 Data Practicum Chat,1379846874,user172748379,Anna Glagoleva,"Я не подскажу по этапам. Если в банке интересно работать, напиши в ЛС, я тебе инфу покажу и передам твое резюме"
2025-02-20T22:05:35,💬 Data Practicum Chat,1379846874,user295904416,Andrey Novikov,опачки
2025-02-20T22:05:44,💬 Data Practicum Chat,1379846874,user295904416,Andrey Novikov,с кем теперь кальян на работе курить
2025-02-20T22:06:16,💬 Data Practicum Chat,1379846874,user172748379,Anna Glagoleva,"Со мной, я в мск"
2025-02-20T22:07:34,💬 Data Practicum Chat,1379846874,user1349934990,Илья,
2025-02-20T22:07:55,💬 Data Practicum Chat,1379846874,user172748379,Anna Glagoleva,Зочем?
2025-02-20T22:08:16,💬 Data Practicum Chat,1379846874,user295904416,Andrey Novikov,действительно муж не стена
2025-02-20T22:17:09,💬 Data Practicum Chat,1379846874,user168336377,Мариян Умагалова,
2025-02-20T22:18:00,💬 Data Practicum Chat,1379846874,user168336377,Мариян Умагалова,Найдем мы тебе кальянщицу)
2025-02-20T22:19:19,💬 Data Practicum Chat,1379846874,user295904416,Andrey Novikov,"такую же опытную, наврядли"
2025-02-20T22:19:32,💬 Data Practicum Chat,1379846874,user168336377,Мариян Умагалова,"Ок. Я почему спросила, слышала, что минимум 2 собеса в альфу. Пока не планирую менять работу."
2025-02-20T22:19:46,💬 Data Practicum Chat,1379846874,user1349934990,Илья,Мне найди
2025-02-20T22:20:10,💬 Data Practicum Chat,1379846874,user1349934990,Илья,"Можно не в Сбере, я поскромнее"
2025-02-20T22:20:12,💬 Data Practicum Chat,1379846874,user168336377,Мариян Умагалова,Какой ты противный
2025-02-20T22:21:05,💬 Data Practicum Chat,1379846874,user168336377,Мариян Умагалова,Ну ладно тебе самую классную найдём
2025-02-20T22:21:49,💬 Data Practicum Chat,1379846874,user1349934990,Илья,Чуть не забыл
2025-02-20T22:21:53,💬 Data Practicum Chat,1379846874,user1349934990,Илья,Спасибо
2025-02-20T22:21:59,💬 Data Practicum Chat,1379846874,user295904416,Andrey Novikov,но на всякий случай напишу в СБ все-таки
2025-02-20T22:22:10,💬 Data Practicum Chat,1379846874,user1349934990,Илья,Тут же универсальная валюта
2025-02-20T22:22:52,💬 Data Practicum Chat,1379846874,user168336377,Мариян Умагалова,И что они мне сделают?
2025-02-20T22:22:56,💬 Data Practicum Chat,1379846874,user168336377,Мариян Умагалова,
2025-02-20T22:23:20,💬 Data Practicum Chat,1379846874,user168336377,Мариян Умагалова,Я не сразу поняла
2025-02-20T22:24:53,💬 Data Practicum Chat,1379846874,user295904416,Andrey Novikov,заставят пользоваться сберчатом
2025-02-20T22:25:24,💬 Data Practicum Chat,1379846874,user168336377,Мариян Умагалова,Я добровольно им пользуюсь
2025-02-20T22:26:22,💬 Data Practicum Chat,1379846874,user60031833,Sergey,Твои вкусы специфичны)
2025-02-20T22:32:28,💬 Data Practicum Chat,1379846874,user449420757,Vadim,Вам втб надо там мессенджер команда и сфера вместо конфы и джиры
2025-02-20T22:34:46,💬 Data Practicum Chat,1379846874,user449420757,Vadim,"Точнее мессенджер команда, телега и маттермост одновременно. Телефон хотелось порой просто разбить"
2025-02-20T23:04:07,💬 Data Practicum Chat,1379846874,user172748379,Anna Glagoleva,Так везде минимум 2 собеса
2025-02-20T23:06:34,💬 Data Practicum Chat,1379846874,user295904416,Andrey Novikov,везде по-разному
2025-02-20T23:14:46,💬 Data Practicum Chat,1379846874,user449420757,Vadim,И скрининг от hr
2025-02-20T23:16:48,💬 Data Practicum Chat,1379846874,user172748379,Anna Glagoleva,Это собеседованием не считается?
2025-02-20T23:19:48,💬 Data Practicum Chat,1379846874,user449420757,Vadim,Нет. Там техническое интервью и интервью с командой или руководством
2025-02-20T23:20:22,💬 Data Practicum Chat,1379846874,user449420757,Vadim,Ну 2 года назад так было
2025-02-20T23:24:25,💬 Data Practicum Chat,1379846874,user40196989,Алексей Яцына,Звучит как анализы сдать
2025-02-20T23:36:00,💬 Data Practicum Chat,1379846874,user172748379,Anna Glagoleva,"Щас все HR расстроились, что их за людей не считают. И беседа с ними - не собеседование"
2025-02-20T23:36:02,💬 Data Practicum Chat,1379846874,user168336377,Мариян Умагалова,Не везде. Hr собес я не считаю. Это разговор по телефону длиною в 5 минут) или в тг спросит че как готова?)
2025-02-20T23:36:22,💬 Data Practicum Chat,1379846874,user168336377,Мариян Умагалова,Не забыв приложить ссыль на вакансию
2025-02-20T23:37:07,💬 Data Practicum Chat,1379846874,user172748379,Anna Glagoleva,У меня с hR полноценно по 30-45 минут встречи идут. Я вопросы задаю не меньше Hr
2025-02-20T23:37:09,💬 Data Practicum Chat,1379846874,user168336377,Мариян Умагалова,"Вообщем, последний раз когда была в поисках, у меня только один собес состоял из двух этапов"
2025-02-20T23:38:48,💬 Data Practicum Chat,1379846874,user168336377,Мариян Умагалова,"Так они никогда подробности не знают. Или даже если ответят на вопросы, потом на собесе узнаешь что все иначе"
2025-02-20T23:39:31,💬 Data Practicum Chat,1379846874,user168336377,Мариян Умагалова,У нас чат аналитиков а не hr
2025-02-20T23:39:38,💬 Data Practicum Chat,1379846874,user168336377,Мариян Умагалова,Некому расстраиваться)
2025-02-20T23:41:07,💬 Data Practicum Chat,1379846874,user172748379,Anna Glagoleva,"Вот и я говорю, что их за людей не считаю)"
2025-02-20T23:41:47,💬 Data Practicum Chat,1379846874,user449420757,Vadim,Ну можно не понравится hr и не пройти дальше. У меня такого не было))
2025-02-20T23:42:06,💬 Data Practicum Chat,1379846874,user295904416,Andrey Novikov,Вызываешь подозрения
2025-02-20T23:42:40,💬 Data Practicum Chat,1379846874,user172748379,Anna Glagoleva,У меня было
2025-02-20T23:42:51,💬 Data Practicum Chat,1379846874,user172748379,Anna Glagoleva,Я мало кому нравлюсь
2025-02-20T23:43:15,💬 Data Practicum Chat,1379846874,user295904416,Andrey Novikov,"а так зависит от компании, где-то эйчару дают базовые вопросы с ответами"
2025-02-20T23:43:36,💬 Data Practicum Chat,1379846874,user295904416,Andrey Novikov,"он их задает и сверяет, у нас так было кстати когда аналситов нанимали"
2025-02-20T23:44:46,💬 Data Practicum Chat,1379846874,user295904416,Andrey Novikov,"в вк например можно сказать есть полноценная секция с эйчар, там рил созвоны на 30-40 мин"
2025-02-20T23:45:32,💬 Data Practicum Chat,1379846874,user168336377,Мариян Умагалова,Чтобы эти добрячки отрабатывали свою зп?
2025-02-20T23:45:39,💬 Data Practicum Chat,1379846874,user168336377,Мариян Умагалова,Другого смысла не вижу
2025-02-20T23:45:57,💬 Data Practicum Chat,1379846874,user168336377,Мариян Умагалова,Если все равно главная цель - понравиться команде
2025-02-20T23:46:03,💬 Data Practicum Chat,1379846874,user449420757,Vadim,Самая жесть это попасть к тем кто на аутстафф берет. Одни и те же вопросы по кругу
2025-02-20T23:46:03,💬 Data Practicum Chat,1379846874,user168336377,Мариян Умагалова,ВП
2025-02-20T23:47:16,💬 Data Practicum Chat,1379846874,user295904416,Andrey Novikov,"эйчар собирает доп инфу, проходит по базовым вопросам, типо делает дополнительное саммари для рук-ля"
2025-02-20T23:47:39,💬 Data Practicum Chat,1379846874,user295904416,Andrey Novikov,так то плохой рекрутер это горе в семье
2025-02-20T23:47:54,💬 Data Practicum Chat,1379846874,user295904416,Andrey Novikov,можно очень много времени в пустую потратить
2025-02-20T23:48:35,💬 Data Practicum Chat,1379846874,user168336377,Мариян Умагалова,Вот это я думаю и есть тратить время впустую
2025-02-20T23:49:23,💬 Data Practicum Chat,1379846874,user168336377,Мариян Умагалова,"Потому что по большей части хр не может проверить твои харды. Ну поговорит с тобой, спросит базу. Только время потратите оба"
2025-02-20T23:49:47,💬 Data Practicum Chat,1379846874,user449420757,Vadim,Самое прикольное было когда требования на аналитика прислали: Питон на уровне мидл Архитектор Девопс
2025-02-21T00:00:35,💬 Data Practicum Chat,1379846874,user295904416,Andrey Novikov,"в работе важны нетолько харды а зачастую софты важнее, нанимающиему менеджеру важно понимать: твою мотивацию в работе, твои ожидания от поиска, насколько ты соотвествуешь культуре компании, насколько ты в целом адекватный и тд и тп это все можно понять на уровне эйчара, даже базовые харды можно отдать на проверку эйчару, любая доп инфа помогает найти более релевантного кандидата"
2025-02-21T00:13:24,💬 Data Practicum Chat,1379846874,user168336377,Мариян Умагалова,Это разговор на 30-40 минут?
2025-02-21T00:13:46,💬 Data Practicum Chat,1379846874,user168336377,Мариян Умагалова,Маааксимум минут 15
2025-02-21T00:16:23,💬 Data Practicum Chat,1379846874,user172748379,Anna Glagoleva,А ты сама когда-нибудь собеседовала людей?
2025-02-21T00:33:12,💬 Data Practicum Chat,1379846874,user100092469,Irina,"Вот ты неадекватный, скажи, как собес проходил? Как эйчаров нагрел"
2025-02-21T00:33:23,💬 Data Practicum Chat,1379846874,user100092469,Irina,Хотя может там корпоративная культура я хз
2025-02-21T00:40:55,💬 Data Practicum Chat,1379846874,user295904416,Andrey Novikov,"да, потому что там и про опыт детально спрашивают"
2025-02-21T00:41:44,💬 Data Practicum Chat,1379846874,user295904416,Andrey Novikov,"я продолжаю с тобой общаться несмотря на отсутствие нюдсов, где ты видела еще более адекватного человека))"
2025-02-21T00:45:17,💬 Data Practicum Chat,1379846874,user100092469,Irina,
2025-02-21T09:45:57,💬 Data Practicum Chat,1379846874,[],[],
2025-02-21T09:52:55,💬 Data Practicum Chat,1379846874,user60031833,Sergey,"Посмотрел бы я как ты бы перестал общаться со всеми, чьих нюдсов ты не видел. Наверное, вообще бы молчал"
2025-02-21T09:54:10,💬 Data Practicum Chat,1379846874,user295904416,Andrey Novikov,"не, с тобой бы я например не стал общаться без нюдсов"
2025-02-21T09:57:49,💬 Data Practicum Chat,1379846874,user1349934990,Илья,Он настолько неинтересный или настолько привлекательный?
2025-02-21T11:09:08,💬 Data Practicum Chat,1379846874,user295904416,Andrey Novikov,"не, просто я сделал исключение для Иры, как видишь я с ним продолжаю общаться значит условие выполнено)"
2025-02-21T13:01:20,💬 Data Practicum Chat,1379846874,[],[],
2025-02-21T13:24:03,💬 Data Practicum Chat,1379846874,user168336377,Мариян Умагалова,Нет
2025-02-21T14:03:04,💬 Data Practicum Chat,1379846874,channel1763861461,DATA ALUMNI PRACTICUM,"Пет-проекты для аналитиков: как наполнить портфолио рабочими кейсами Каким пет-проектом заняться аналитику данных зимой? Вариантов много. Например, сделать инфографику самых высоких городских ёлок или разработать бота, который посчитает, какого объёма нужен таз под оливье. А вот зачем и как правильно создавать пет-проекты — читайте в статье по ссылке."
2025-02-21T14:14:55,💬 Data Practicum Chat,1379846874,[],[],
2025-02-21T14:36:37,💬 Data Practicum Chat,1379846874,user62472764,Oleg Zhukov,"Можно узнать, есть какие-то новости по этому проекту? Вроде бы, собирались стартовать в середине февраля"
2025-02-21T14:39:09,💬 Data Practicum Chat,1379846874,user262309349,Arsen (არსენა) Хабибуллин,"предполагаю, что уже идет…."
2025-02-21T14:43:01,💬 Data Practicum Chat,1379846874,user62472764,Oleg Zhukov,Должны были добавить в чат и расшарить доступ в личном кабинете. Пока тишина. Вас добавили куда-то?
2025-02-21T14:44:03,💬 Data Practicum Chat,1379846874,user262309349,Arsen (არსენა) Хабибуллин,"нууууу, если вам писали, что вы прошли, наверное, вопросы надо задавать тому, кто это написал?"
2025-02-21T14:45:33,💬 Data Practicum Chat,1379846874,user329172522,George,Nda не заполнили
2025-02-21T14:46:04,💬 Data Practicum Chat,1379846874,user62472764,Oleg Zhukov,Заполнил
2025-02-21T14:46:22,💬 Data Practicum Chat,1379846874,user60031833,Sergey,"Скорее, не написали об этом в чате)"
2025-02-21T14:47:58,💬 Data Practicum Chat,1379846874,user62472764,Oleg Zhukov,"Мне кажется, это не так работает) Его надо было подписать, прикрепить к анкете и отправить. Что я и сделал."
2025-02-21T14:51:03,💬 Data Practicum Chat,1379846874,[],[],
2025-02-21T14:51:41,💬 Data Practicum Chat,1379846874,user262309349,Arsen (არსენა) Хабибуллин,"выше - стеб, кмк, есть инфа, что всем уже написали, кого отобрали"
2025-02-21T14:52:51,💬 Data Practicum Chat,1379846874,user62472764,Oleg Zhukov,Я об этом и хотел как раз узнать. Спасибо. Могли бы и всем остальным написать)
2025-02-21T14:53:19,💬 Data Practicum Chat,1379846874,user262309349,Arsen (არსენა) Хабибуллин,"Слишком большой набор людей, наверное"
2025-02-21T14:53:56,💬 Data Practicum Chat,1379846874,user62472764,Oleg Zhukov,Наверное)
2025-02-21T16:45:04,💬 Data Practicum Chat,1379846874,user589815330,"Катерина Ефремова [+2,5ч мск]",Уточню по статусу у коллег)
2025-02-21T16:47:31,💬 Data Practicum Chat,1379846874,[],[],
2025-02-21T22:47:28,💬 Data Practicum Chat,1379846874,[],[],
2025-02-21T23:21:21,💬 Data Practicum Chat,1379846874,user613294865,Sherlock Holmes,"Ребята, если я хочу работать специалистом по машинному обучению, то как лучше выстроить маршрут: сначала стать аналитиком данных, набраться опыта и затем в машинное обучение или же сразу попробовать в ML без промежуточных этапов? Я только закончил Практикум, опыта нет ни там ни там."
2025-02-21T23:35:17,💬 Data Practicum Chat,1379846874,user138849259,Dmitry Polikarpov,Я лично выбрал первое.
2025-02-22T00:46:27,💬 Data Practicum Chat,1379846874,user449420757,Vadim,Я с тех писа стартовал самозанятым в ии. Работая в в аналитике в банке
2025-02-22T07:15:17,💬 Data Practicum Chat,1379846874,user1349934990,Илья,Как успехи?
2025-02-22T09:01:45,💬 Data Practicum Chat,1379846874,user138849259,Dmitry Polikarpov,"Устроился на работу как DA, параллельно продолжаю учиться на DS."
2025-02-22T09:09:01,💬 Data Practicum Chat,1379846874,user252926140,Valeratal,"Не то что бы я специалист, но кажется либо ритейл, либо оптовая торговля Ритейл это розничная торговля Оптовый ритейл это ерунда какая то"
2025-02-22T09:51:07,💬 Data Practicum Chat,1379846874,user317277992,Ksenia,Я собеседую из 10 собесов прошел 1 только. И то мы сейчас продолжаем смотреть. И на некоторых собесах хочется плакать просто.
2025-02-22T09:51:48,💬 Data Practicum Chat,1379846874,user317277992,Ksenia,Они писали) посмотрите спам
2025-02-22T09:52:10,💬 Data Practicum Chat,1379846874,user172748379,Anna Glagoleva,"Блин, могу представить"
2025-02-22T09:53:42,💬 Data Practicum Chat,1379846874,user317277992,Ksenia,"Не, там иногда такие шедевры бывают. И плюс, есть нюанс, что как бывший hr, я еще и резюме вычитываю. Многие врут очень много там, накручивают, в общении тоже начинают говорить что они делают, а когда задаешь вопросы в этом направлении - сразу сыпятся."
2025-02-22T09:54:57,💬 Data Practicum Chat,1379846874,user172748379,Anna Glagoleva,"Ну я вот об этом и обудамала… На резюме я Лев Толстой, а деле х@й простой…."
2025-02-22T09:55:57,💬 Data Practicum Chat,1379846874,user172748379,Anna Glagoleva,"Я кстати свою первую работу обманом получила, но и мне там пообещали еще больше чем я"
2025-02-22T09:56:29,💬 Data Practicum Chat,1379846874,user317277992,Ksenia,При чем скрининг они хорошо проходят. А вот тех часть уже - рулетка Мое участие в этом закончится 28.02
2025-02-22T09:58:20,💬 Data Practicum Chat,1379846874,user172748379,Anna Glagoleva,А что будет 28.02?)
2025-02-22T09:59:02,💬 Data Practicum Chat,1379846874,user317277992,Ksenia,Мой последний день в текущей команде) покидаю @iatcyna
2025-02-22T09:59:24,💬 Data Practicum Chat,1379846874,user40196989,Алексей Яцына,Да мы виделись то 3 раза за год
2025-02-22T09:59:25,💬 Data Practicum Chat,1379846874,user172748379,Anna Glagoleva,Поздравляю! А куда дальше?))
2025-02-22T10:00:40,💬 Data Practicum Chat,1379846874,user317277992,Ksenia,Больше
2025-02-22T10:28:22,💬 Data Practicum Chat,1379846874,user1349934990,Илья,"Работодатель, накрутивший вилку Соискатель, накрутивший опыт"
2025-02-22T14:17:55,💬 Data Practicum Chat,1379846874,user5160000471,Vasily Artemyev,
2025-02-22T14:22:16,💬 Data Practicum Chat,1379846874,user262309349,Arsen (არსენა) Хабибуллин,"коллеги подскажите пожалуйста, можно ли сюда скидывать опросы для учебных/академических целей?"
2025-02-22T14:22:31,💬 Data Practicum Chat,1379846874,user100092469,Irina,скидавай
2025-02-22T14:22:34,💬 Data Practicum Chat,1379846874,user100092469,Irina,портки
2025-02-22T14:22:45,💬 Data Practicum Chat,1379846874,user262309349,Arsen (არსენა) Хабибуллин,это в лс же договорились....
2025-02-22T14:22:57,💬 Data Practicum Chat,1379846874,user100092469,Irina,блин точно
2025-02-22T14:23:00,💬 Data Practicum Chat,1379846874,user100092469,Irina,НЕ В ТОТ ЧАТ
2025-02-22T14:23:02,💬 Data Practicum Chat,1379846874,user100092469,Irina,ахахахаха
2025-02-22T14:23:32,💬 Data Practicum Chat,1379846874,user262309349,Arsen (არსენა) Хабибуллин,"субботнее утро, а уже без портков"
